{
  "$schema": "https://json-schema.org/draft/2020-12/schema",
  "$id": "urn:dev-team:event-handler",
  "title": "event-handler.<Name>EventHandler.json — 事件处理",
  "type": "object", "additionalProperties": false,
  "required": ["name", "module", "trigger", "writes", "steps", "raises", "throws", "traces", "questions"],
  "properties": {
    "name": { "type": "string", "pattern": "^[A-Z][A-Za-z0-9]*On[A-Z][A-Za-z0-9]*$", "description": "<动作>On<事件名>" },
    "module": { "$ref": "urn:dev-team:common#/$defs/modelName" },
    "trigger": { "$ref": "urn:dev-team:common#/$defs/qualifiedName" },
    "writes": { "$ref": "urn:dev-team:common#/$defs/writes" },
    "writesNote": { "type": "string", "minLength": 1 },
    "steps": { "$ref": "urn:dev-team:common#/$defs/steps" },
    "raises": { "$ref": "urn:dev-team:common#/$defs/raises" },
    "throws": { "$ref": "urn:dev-team:common#/$defs/throws" },
    "traces": { "$ref": "urn:dev-team:common#/$defs/traces" },
    "questions": { "$ref": "urn:dev-team:common#/$defs/questions" },
    "decisions": { "$ref": "urn:dev-team:common#/$defs/decisions" }
  },
  "if": { "properties": { "writes": { "type": "array", "minItems": 2 } } },
  "then": { "properties": { "writesNote": { "type": "string", "minLength": 1 } }, "required": ["writesNote"] }
}
